{
  "$schema": "https://json-schema.org/draft/2020-12/schema",
  "$id": "https://mokume.org/schemas/observe-report.schema.json",
  "title": "The observation reply",
  "description": "The result of an observation and the catalogue of images taken. The images are separate files, and this reply is written atomically, last. A reader judges completeness by the catalogue (frames) being present, the id matching, and the count agreeing — **when the request was clamped to its range (above the ceiling, or below the floor of 1), it agrees with the count after clamping**, so checking against the requested count alone reads a complete reply as a failure (the clamp, and the bound it hit, appear in warnings). A reply is written even when nothing could be taken, with the reason in warnings (ADR-0018 decision 3).",
  "type": "object",
  "required": [
    "schemaVersion",
    "id",
    "frame",
    "time",
    "size",
    "warnings",
    "frames"
  ],
  "additionalProperties": false,
  "properties": {
    "schemaVersion": {
      "const": 2,
      "description": "The version of this reply's format. How it is raised is ADR-0018 decision 5."
    },
    "id": {
      "type": "string",
      "minLength": 1,
      "description": "The identifier of the request this answers. A reader knows it is done by this matching."
    },
    "image": {
      "type": "string",
      "minLength": 1,
      "description": "The file name of the last image taken, relative to this reply. Omitted when the declared number of shots did not come together, so a reader may treat the absence of this key as failure. Each entry in frames carries its own name, so a reader never has to construct one."
    },
    "frame": {
      "type": "integer",
      "minimum": 0,
      "description": "The number of the frame this reply was written on. When everything came together, the same as the last frame taken."
    },
    "time": {
      "type": "number",
      "description": "The time of the frame this reply was written on, in seconds."
    },
    "size": {
      "type": "object",
      "required": [
        "width",
        "height"
      ],
      "additionalProperties": false,
      "description": "The size of the surface that was drawn, in pixels.",
      "properties": {
        "width": {
          "type": "integer",
          "minimum": 1
        },
        "height": {
          "type": "integer",
          "minimum": 1
        }
      }
    },
    "warnings": {
      "type": "array",
      "items": {
        "type": "string"
      },
      "description": "Anything that had to be noted while taking the shots. When it failed, the reason is here. The warnings the sketch itself said (for example a call that was ignored) are added after that, once each: a warning appears in the first reply after it was said and not in later ones. At most 20 of them are kept per reply; when more were said, a last line gives the number left out. An empty array when there is nothing."
    },
    "stats": {
      "$ref": "#/$defs/stats",
      "description": "A summary of the last image taken. **Omitted when the declared number of shots did not come together** — omitted even if some were taken, so the condition is the same as image. Summaries of what was taken up to that point are carried by the entries in frames."
    },
    "load": {
      "type": "object",
      "description": "How hard it is working. Carried so that fast or slow is answered with a number rather than guessed from the picture.",
      "required": [
        "thermalState"
      ],
      "additionalProperties": false,
      "properties": {
        "frameRate": {
          "type": "number",
          "minimum": 0,
          "description": "The frame rate actually coming out just now. Omitted before it can be measured and **while frames have not advanced for a while**, so that a stale number is never named during a stall."
        },
        "frameTimeMs": {
          "type": "object",
          "description": "The interval between recent frames, in milliseconds. Omitted before it can be measured and **while frames have not advanced for a while** (the same condition as frameRate).",
          "required": [
            "mean",
            "max"
          ],
          "additionalProperties": false,
          "properties": {
            "mean": {
              "type": "number",
              "minimum": 0
            },
            "max": {
              "type": "number",
              "minimum": 0
            }
          }
        },
        "overBudgetFrames": {
          "type": "integer",
          "minimum": 0,
          "description": "How many frames since launch took longer than one frame's budget (1 / the declared frame rate). Measured as the frame's own work — from advancing the time to finishing the picture — so setup() and waiting for the display are not counted. **Under the frame clock (`clock: .frames`) each of these frames is a slowdown**, since the picture is never skipped. A count, so it is always present in a reply written by this version."
        },
        "heaviestFrame": {
          "type": "object",
          "description": "The frame since launch whose work took longest. Omitted before any frame has been measured.",
          "required": [
            "frame",
            "ms"
          ],
          "additionalProperties": false,
          "properties": {
            "frame": {
              "type": "integer",
              "minimum": 1,
              "description": "The frame number, counted like frameCount (the first frame is 1)."
            },
            "ms": {
              "type": "number",
              "minimum": 0,
              "description": "How long its work took, in milliseconds."
            }
          }
        },
        "memoryMB": {
          "type": "number",
          "minimum": 0,
          "description": "The physical memory the process is using, in MB. Omitted when it cannot be read."
        },
        "thermalState": {
          "type": "string",
          "description": "The thermal state. A reader should pass an unfamiliar value through rather than drop it, since the range can widen.",
          "examples": [
            "nominal",
            "fair",
            "serious",
            "critical",
            "unknown"
          ]
        }
      }
    },
    "values": {
      "$ref": "#/$defs/values",
      "description": "The values the sketch exposed on the frame this reply was written on, including measured values still carried over (see $defs/values). Omitted when there are none."
    },
    "inputs": {
      "type": "array",
      "description": "The state of each inlet that receives something from outside (a camera, a microphone, a device, the network), and the frame its last value arrived on (ADR-0028 decision 4). It tells why nothing is arriving — waiting for permission, denied, no device, unplugged — without opening the picture. Omitted when no inlet names itself.",
      "items": {
        "type": "object",
        "required": [
          "name",
          "state"
        ],
        "additionalProperties": false,
        "properties": {
          "name": {
            "type": "string",
            "minLength": 1,
            "description": "What the inlet is, for a reader to tell them apart."
          },
          "state": {
            "type": "string",
            "description": "The state of the source: waitingForPermission, denied, running, unavailable (no device; it starts when one is plugged in), disconnected or stopped. A reader passes an unknown value through (ADR-0018 decision 5)."
          },
          "lastFrame": {
            "type": "integer",
            "minimum": 0,
            "description": "The number of the frame the last value was taken on. Omitted until a value has arrived."
          },
          "lastTime": {
            "type": "number",
            "description": "The time of that frame, in seconds. Omitted until a value has arrived."
          }
        }
      }
    },
    "stamp": {
      "type": "string",
      "minLength": 1,
      "description": "Which generation of input produced this image. Returned exactly as the running side passed it. A reader should compare it for equality as an opaque identifier and depend on neither its meaning nor its length. Omitted when nothing was passed."
    },
    "frames": {
      "type": "array",
      "description": "The catalogue of images taken, in the order they were taken. Present even when a single shot was asked for, as a one-element array, because a reply whose shape changed with the count would make every reader start by telling the shapes apart. When it was cut short, only what was taken appears.",
      "items": {
        "type": "object",
        "required": [
          "image",
          "frame",
          "time"
        ],
        "additionalProperties": false,
        "properties": {
          "image": {
            "type": "string",
            "minLength": 1,
            "description": "This image's file name, relative to the reply."
          },
          "frame": {
            "type": "integer",
            "minimum": 0,
            "description": "The number of the frame this image was drawn on. The same number twice in a row means nothing advanced in between."
          },
          "time": {
            "type": "number",
            "description": "The time of the frame this image was drawn on, in seconds."
          },
          "stats": {
            "$ref": "#/$defs/stats",
            "description": "A summary of this image. Carried so that whether anything moved can be judged without opening the picture."
          },
          "values": {
            "$ref": "#/$defs/values",
            "description": "The values the sketch exposed on this frame, including measured values still carried over (see $defs/values). Omitted when there are none."
          }
        }
      }
    },
    "appliedTime": {
      "type": "number",
      "minimum": 0,
      "maximum": 3.4028234663852886e+38,
      "description": "Present only when a requested time was applied AND the single image was captured successfully. Equals the Float-rounded request time, the top-level time and frames[0].time. Absence is never a successful time-specific observation, even if an older writer returns an image at a coincidentally equal time."
    }
  },
  "$defs": {
    "stats": {
      "type": "object",
      "description": "A summary of an image. Carried so that questions like whether it is entirely black, or crowded into a corner, can be judged without opening the picture. Counted in displayable form, after the output stage. **What omits it differs by where it sits** — an entry in the catalogue (frames) always has one, since it has an image, while at the level above it is omitted under the same condition as image (the declared number of shots did not come together).",
      "required": [
        "meanColor",
        "meanLuminance",
        "contentFraction",
        "sampleGrid"
      ],
      "additionalProperties": false,
      "properties": {
        "meanColor": {
          "type": "array",
          "minItems": 3,
          "maxItems": 3,
          "items": {
            "type": "number",
            "minimum": 0,
            "maximum": 1
          },
          "description": "The mean of red, green and blue (0…1)."
        },
        "meanLuminance": {
          "type": "number",
          "minimum": 0,
          "maximum": 1,
          "description": "The mean brightness (0…1): the mean red, green and blue weighted by the Display P3 relative-luminance row (0.228975, 0.691739, 0.079287)."
        },
        "contentFraction": {
          "type": "number",
          "minimum": 0,
          "maximum": 1,
          "description": "The share of sampled points whose colour differs from the ground, meaning the most common colour (0…1). 0 is a uniform image. **The ground is not the top-left point** — taking the top left as the ground swaps content and ground for any image with something drawn there."
        },
        "contentBounds": {
          "type": "object",
          "description": "The bounding box of the points that carry content. The origin is the top left, normalised by width and height. Omitted when there is not a single point.",
          "required": [
            "x",
            "y",
            "width",
            "height"
          ],
          "additionalProperties": false,
          "properties": {
            "x": {
              "type": "number",
              "minimum": 0,
              "maximum": 1
            },
            "y": {
              "type": "number",
              "minimum": 0,
              "maximum": 1
            },
            "width": {
              "type": "number",
              "minimum": 0,
              "maximum": 1
            },
            "height": {
              "type": "number",
              "minimum": 0,
              "maximum": 1
            }
          }
        },
        "sampleGrid": {
          "type": "object",
          "description": "The grid of points that were counted. Sampled on this grid rather than over every pixel.",
          "required": [
            "width",
            "height"
          ],
          "additionalProperties": false,
          "properties": {
            "width": {
              "type": "integer",
              "minimum": 0
            },
            "height": {
              "type": "integer",
              "minimum": 0
            }
          }
        }
      }
    },
    "values": {
      "type": "object",
      "description": "The values the sketch exposed on this frame, as a type and value pair per name. Omitted when there are none. A value given with expose(_:_:) belongs to its frame alone and is gone on the next unless given again. A value taken with measure(_:_:) — the wall-clock milliseconds a piece of work took, as a float — is carried over: the runtime offers it again at the head of every frame until the same name is measured again, so it still reads as a value exposed on this frame. Exposing the same name on a frame wins for that frame only. **A number that is not finite (NaN or infinity) is never exposed**: JSON cannot carry it, so the runtime leaves that value out, says so once on its standard error, and the other values still come. (A name that was measured with measure(_:_:) keeps its measurement, since that is offered again at the head of every frame: exposing a value that is not finite under that name leaves the measurement in place.) Measured values differ from run to run, so do not compare them across runs.",
      "additionalProperties": {
        "type": "object",
        "required": [
          "type",
          "value"
        ],
        "additionalProperties": false,
        "properties": {
          "type": {
            "type": "string",
            "enum": [
              "float",
              "int",
              "string",
              "bool"
            ]
          },
          "value": {}
        }
      }
    }
  },
  "allOf": [
    {
      "if": {
        "required": [
          "appliedTime"
        ]
      },
      "then": {
        "required": [
          "image"
        ],
        "properties": {
          "frames": {
            "minItems": 1,
            "maxItems": 1
          }
        }
      }
    }
  ]
}
